{
  "schema_version": "0.1.0-alpha.1",
  "request_id": "request:golden-001",
  "created_at": "2026-07-28T00:00:00Z",
  "platform": "LINUX",
  "shell": "BASH",
  "command_text": "pwd",
  "requester": {
    "type": "HUMAN",
    "subject_id": "human:synthetic-reviewer",
    "trust_reference": null
  },
  "declared_privilege": "STANDARD_USER",
  "source_classification": "SYNTHETIC_PUBLIC"
}
